{
  "dataset_version": "1-proposed",
  "status": "RESEARCH_PILOT",
  "sources": [
    {
      "source_id": "SRC-dell-u2723qe",
      "url": "https://www.dell.com/en-gb/shop/dell-ultrasharp-27-4k-usb-c-hub-monitor-u2723qe/apd/210-bcxk/monitors-monitor-accessories",
      "title": "Dell UltraSharp 27 4K USB-C Hub Monitor - U2723QE",
      "publisher": "Dell",
      "region": "GB",
      "source_type": "MANUFACTURER_SPEC",
      "reliability_grade": "A",
      "accessed_at": "2026-10-08",
      "source_status": "DIRECT_CHECK",
      "location": "Resolution / Refresh Rate; Ports; Tech Specs"
    },
    {
      "source_id": "SRC-lg-27up850-w",
      "url": "https://www.lg.com/my/monitors/ultrafine-uhd-4k-5k/27up850-w/",
      "title": "27\" UHD 4K IPS Monitor with VESA DisplayHDR 400 - 27UP850-W",
      "publisher": "LG",
      "region": "MY",
      "source_type": "MANUFACTURER_SPEC",
      "reliability_grade": "A",
      "accessed_at": "2026-10-08",
      "source_status": "DIRECT_CHECK",
      "location": "All Spec / INPUT/OUTPUT; PICTURE QUALITY"
    },
    {
      "source_id": "SRC-dell-g2724d",
      "url": "https://www.dell.com/en-us/shop/dell-27-gaming-monitor-g2724d/apd/210-bhxc/monitors-monitor-accessories",
      "title": "Dell 27 Gaming Monitor - G2724D",
      "publisher": "Dell",
      "region": "US",
      "source_type": "MANUFACTURER_SPEC",
      "reliability_grade": "A",
      "accessed_at": "2026-10-08",
      "source_status": "DIRECT_CHECK",
      "location": "Resolution / Refresh Rate; Ports"
    },
    {
      "source_id": "SRC-caldigit-ts4",
      "url": "https://www.caldigit.com/thunderbolt-station-4/",
      "title": "Thunderbolt 4 Dock | TS4 | CalDigit",
      "publisher": "CalDigit",
      "region": "UNSPECIFIED",
      "source_type": "MANUFACTURER_SPEC",
      "reliability_grade": "A",
      "accessed_at": "2026-10-08",
      "source_status": "DIRECT_CHECK",
      "location": "Single 8K or Dual 6K 60Hz Displays; Charging"
    },
    {
      "source_id": "SRC-plugable-ud-6950h",
      "url": "https://plugable.com/products/ud-6950h/",
      "title": "Plugable USB 3.0 and USB-C 4K Dual Monitor Docking Station",
      "publisher": "Plugable",
      "region": "US",
      "source_type": "MANUFACTURER_SPEC",
      "reliability_grade": "A",
      "accessed_at": "2026-10-08",
      "source_status": "DIRECT_CHECK",
      "location": "Features; 12 Ports; Monitor Compatibility; Power and Charging"
    },
    {
      "source_id": "SRC-startech-mst14cd122hd",
      "url": "https://media.startech.com/cms/pdfs/mst14cd122hd_datasheet.pdf",
      "title": "USB-C to Dual HDMI Adapter, USB Type-C Multi-Monitor MST Hub - MST14CD122HD",
      "publisher": "StarTech.com",
      "region": "UNSPECIFIED",
      "source_type": "MANUFACTURER_SPEC",
      "reliability_grade": "A",
      "accessed_at": "2026-10-08",
      "source_status": "DIRECT_CHECK",
      "location": "PDF pp.1–3 / Features; Power; Performance; Hardware"
    },
    {
      "source_id": "SRC-cablematters-201036",
      "url": "https://kb.cablematters.com/index.php?EntryID=79&View=entry",
      "title": "Cable Matters 201036 USB-C to 8K DisplayPort Cable",
      "publisher": "Cable Matters",
      "region": "UNSPECIFIED",
      "source_type": "MANUFACTURER_SUPPORT",
      "reliability_grade": "B",
      "accessed_at": "2026-10-08",
      "source_status": "DIRECT_CHECK",
      "location": "Article 79 / introductory specification; full 8K troubleshooting",
      "published_or_updated_at": "2022-08-17"
    },
    {
      "source_id": "SRC-belkin-avc002",
      "url": "https://www.belkin.com/tw/en/p/usb-c-to-hdmi-charge-adapter/P-AVC002.html",
      "title": "USB-C to HDMI + Charge Adapter",
      "publisher": "Belkin",
      "region": "TW",
      "source_type": "MANUFACTURER_SPEC",
      "reliability_grade": "A",
      "accessed_at": "2026-10-08",
      "source_status": "DIRECT_CHECK",
      "location": "POWER AND VIDEO; CHARGE WHILE YOU WORK; ULTRA-HIGH-DEFINITION VIDEO"
    },
    {
      "source_id": "SRC-apple-tb4-pro-cable",
      "url": "https://support.apple.com/en-gb/118204",
      "title": "About the Apple Thunderbolt Pro Cables",
      "publisher": "Apple",
      "region": "GB",
      "source_type": "MANUFACTURER_SUPPORT",
      "reliability_grade": "B",
      "accessed_at": "2026-10-08",
      "source_status": "DIRECT_CHECK",
      "location": "Video; Data transfer; Charging / Thunderbolt 4-specific paragraphs",
      "published_or_updated_at": "2024-11-25"
    }
  ],
  "products": [
    {
      "product_id": "product:dell-u2723qe",
      "kind": "DISPLAY",
      "manufacturer": "Dell",
      "model": "U2723QE",
      "region": "GB",
      "source_refs": [
        "SRC-dell-u2723qe"
      ],
      "missing_fields": [
        "두 번째 USB-C upstream 영상 지원 명시",
        "DSC/레인 설정 및 DP 출력 라우팅",
        "PD 전압·전류 프로파일",
        "포트별 픽셀 타이밍"
      ],
      "review_status": "PENDING_HUMAN_REVIEW",
      "identity_status": "EXACT"
    },
    {
      "product_id": "product:lg-27up850-w",
      "kind": "DISPLAY",
      "manufacturer": "LG",
      "model": "27UP850-W",
      "region": "MY",
      "source_refs": [
        "SRC-lg-27up850-w"
      ],
      "missing_fields": [
        "입력별 최대 타이밍",
        "DP 버전·레인·DSC",
        "PD 전압·전류",
        "한국 지역 모델 대조"
      ],
      "review_status": "PENDING_HUMAN_REVIEW",
      "identity_status": "EXACT"
    },
    {
      "product_id": "product:dell-g2724d",
      "kind": "DISPLAY",
      "manufacturer": "Dell",
      "model": "G2724D",
      "region": "US",
      "source_refs": [
        "SRC-dell-g2724d"
      ],
      "missing_fields": [
        "색 깊이·chroma·DSC 조건",
        "포트별 EDID 타이밍",
        "동봉 USB-C→DP 케이블 모델"
      ],
      "review_status": "PENDING_HUMAN_REVIEW",
      "identity_status": "EXACT"
    },
    {
      "product_id": "product:caldigit-ts4",
      "kind": "DOCK",
      "manufacturer": "CalDigit",
      "model": "TS4",
      "region": "UNSPECIFIED",
      "source_refs": [
        "SRC-caldigit-ts4"
      ],
      "missing_fields": [
        "내부 독립 스트림 토폴로지와 공유 자원",
        "포트별 simultaneous allocation",
        "PD 전압·전류",
        "지원 표와 FAQ의 조건 정합성 검토"
      ],
      "review_status": "PENDING_HUMAN_REVIEW",
      "identity_status": "EXACT"
    },
    {
      "product_id": "product:plugable-ud-6950h",
      "kind": "DOCK",
      "manufacturer": "Plugable",
      "model": "UD-6950H",
      "region": "US",
      "source_refs": [
        "SRC-plugable-ud-6950h"
      ],
      "missing_fields": [
        "DP/HDMI 쌍별 채널 매핑",
        "DisplayLink 버전·권한·DRM 조건",
        "제품 단종 후 문서 갱신"
      ],
      "review_status": "PENDING_HUMAN_REVIEW",
      "identity_status": "EXACT"
    },
    {
      "product_id": "product:startech-mst14cd122hd",
      "kind": "HUB",
      "manufacturer": "StarTech.com",
      "model": "MST14CD122HD",
      "region": "UNSPECIFIED",
      "source_refs": [
        "SRC-startech-mst14cd122hd"
      ],
      "missing_fields": [
        "MST 공유 대역폭 계산",
        "macOS 복제 동작 별도 근거",
        "DSC 조건별 resolution chart"
      ],
      "review_status": "PENDING_HUMAN_REVIEW",
      "identity_status": "EXACT"
    },
    {
      "product_id": "product:cablematters-201036",
      "kind": "CABLE",
      "manufacturer": "Cable Matters",
      "model": "201036",
      "region": "UNSPECIFIED",
      "source_refs": [
        "SRC-cablematters-201036"
      ],
      "missing_fields": [
        "세부 길이·하드웨어 리비전·펌웨어",
        "역방향 지원 여부",
        "lane/encoding·픽셀 타이밍",
        "고주사율 색 조건"
      ],
      "review_status": "PENDING_HUMAN_REVIEW",
      "identity_status": "EXACT"
    },
    {
      "product_id": "product:belkin-avc002",
      "kind": "ADAPTER",
      "manufacturer": "Belkin",
      "model": "AVC002BK-BL / AVC002btBK",
      "region": "TW",
      "source_refs": [
        "SRC-belkin-avc002"
      ],
      "missing_fields": [
        "입력 PD 프로파일·자체 소비",
        "DP/HDMI 협상 버전·DSC",
        "역방향 사용",
        "리비전별 조건"
      ],
      "review_status": "PENDING_HUMAN_REVIEW",
      "identity_status": "EXACT"
    },
    {
      "product_id": "product:apple-tb4-pro-cable",
      "kind": "CABLE",
      "manufacturer": "Apple",
      "model": "Thunderbolt 4 Pro Cable (제품군)",
      "region": "GB",
      "source_refs": [
        "SRC-apple-tb4-pro-cable"
      ],
      "missing_fields": [
        "정확한 SKU·길이·리비전",
        "PD voltage/current·e-marker 세부",
        "DSC 처리 역할"
      ],
      "review_status": "PENDING_HUMAN_REVIEW",
      "identity_status": "PARTIAL"
    }
  ],
  "facts": [
    {
      "fact_id": "dell-u2723qe:1",
      "product_id": "product:dell-u2723qe",
      "property": "VIDEO_PROFILE",
      "summary": "패널 기본 해상도 3840×2160 60Hz",
      "source_refs": [
        "SRC-dell-u2723qe"
      ],
      "location": "Resolution / Refresh Rate; Ports; Tech Specs",
      "source_status": "DIRECT_CHECK",
      "review_status": "PENDING_HUMAN_REVIEW",
      "conditions": [],
      "payload": {
        "scope": "PANEL",
        "width": 3840,
        "height": 2160,
        "refresh_hz": 60,
        "interface": "UNKNOWN"
      }
    },
    {
      "fact_id": "dell-u2723qe:2",
      "product_id": "product:dell-u2723qe",
      "property": "PROTOCOL",
      "summary": "영상용 USB-C upstream은 DP 1.4 Alt Mode",
      "source_refs": [
        "SRC-dell-u2723qe"
      ],
      "location": "Resolution / Refresh Rate; Ports; Tech Specs",
      "source_status": "DIRECT_CHECK",
      "review_status": "PENDING_HUMAN_REVIEW",
      "conditions": [],
      "payload": {
        "interface": "USB_C_VIDEO_UPSTREAM",
        "protocol": "DISPLAYPORT",
        "version": "1.4",
        "mode": "ALT_MODE",
        "support": "SUPPORTED"
      }
    },
    {
      "fact_id": "dell-u2723qe:3",
      "product_id": "product:dell-u2723qe",
      "property": "POWER_TRANSFER",
      "summary": "영상용 USB-C upstream에서 최대 90W 공급",
      "source_refs": [
        "SRC-dell-u2723qe"
      ],